{
	"$schema": "../../schemas/pixel-v2.schema.json",
	"id": "google-ads",
	"chismografo": {
		"tipo": 5,
		"version": "1.0.0",
		"ultimaActualizacion": "2026-09-11",
		"revision": 0,
		"entorno": 2
	},
	"acercaDe": {
		"detallesGenerales": {
			"nombre": "Google Ads",
			"web": "https://ads.google.com/",
			"categoria": "Píxeles / Tracking",
			"logo": {
				"id": "ads.google.com",
				"proveedor": "logodev"
			}
		},
		"precios": []
	},
	"herramienta": {
		"reglasDeteccion": [
			{
				"tipo": "script-src",
				"patron": "googletagmanager\\.com\\/gtag\\/js\\?id=AW-",
				"descripcion": "Google Ads script detectado",
				"peso": 1
			},
			{
				"tipo": "script-content",
				"patron": "gtag\\('config'\\s*,\\s*['\"]AW-",
				"descripcion": "Google Ads configuración detectada",
				"peso": 0.8
			}
		]
	}
}
