{
	"$schema": "../../schemas/pixel-v2.schema.json",
	"id": "google-tag-manager",
	"chismografo": {
		"tipo": 5,
		"version": "1.0.0",
		"ultimaActualizacion": "2026-09-11",
		"revision": 0,
		"entorno": 2
	},
	"acercaDe": {
		"detallesGenerales": {
			"nombre": "Google Tag Manager",
			"desarrollador": "Google Tag Manager",
			"web": "https://www.google.com",
			"categoria": "Analítica",
			"logo": {
				"id": "google.com",
				"proveedor": "local"
			}
		},
		"precios": []
	},
	"herramienta": {
		"reglasDeteccion": [
			{
				"tipo": "script-src",
				"patron": "googletagmanager\\.com\\/gtm\\.js",
				"descripcion": "Google Tag Manager integration script or resource detected"
			}
		]
	}
}
