{
	"$schema": "../../schemas/pixel-v2.schema.json",
	"id": "microsoft-clarity",
	"chismografo": {
		"tipo": 5,
		"version": "1.0.0",
		"ultimaActualizacion": "2026-09-11",
		"revision": 0,
		"entorno": 2
	},
	"acercaDe": {
		"detallesGenerales": {
			"nombre": "Microsoft Clarity",
			"web": "https://clarity.microsoft.com",
			"categoria": "Analítica",
			"logo": {
				"id": "clarity.microsoft.com",
				"proveedor": "brandicons"
			}
		},
		"precios": []
	},
	"herramienta": {
		"reglasDeteccion": [
			{
				"tipo": "script-src",
				"patron": "clarity\\.ms\\/tag\\/|clarity\\.ms\\/s\\/|scripts\\.clarity\\.ms|www\\.clarity\\.ms|clarity\\.js",
				"descripcion": "Microsoft Clarity script detectado",
				"peso": 1
			},
			{
				"tipo": "script-content",
				"patron": "clarity\\.ms\\/tag|\\(window,\\s*document,\\s*[\"']clarity[\"']|window\\[[\"']clarity[\"']\\]|window\\.clarity\\s*=|clarity\\([\"']set[\"']|clarity\\([\"']identify[\"']|clarity\\([\"']consent[\"']",
				"descripcion": "Microsoft Clarity configuración o inicialización detectada",
				"peso": 0.8
			}
		]
	}
}
