{
	"$schema": "../../schemas/pixel-v2.schema.json",
	"id": "google-analytics",
	"chismografo": {
		"tipo": 5,
		"version": "1.0.0",
		"ultimaActualizacion": "2026-09-11",
		"revision": 0,
		"entorno": 2
	},
	"acercaDe": {
		"detallesGenerales": {
			"nombre": "Google Analytics",
			"web": "https://analytics.google.com/",
			"categoria": "Analítica",
			"logo": {
				"id": "googleanalytics4.com",
				"proveedor": "logodev"
			}
		},
		"precios": []
	},
	"herramienta": {
		"reglasDeteccion": [
			{
				"tipo": "script-src",
				"patron": "googletagmanager\\.com\\/gtag\\/js",
				"descripcion": "Google Analytics (gtag.js) detectado",
				"peso": 1
			},
			{
				"tipo": "script-src",
				"patron": "google-analytics\\.com\\/analytics\\.js",
				"descripcion": "Google Analytics (analytics.js) detectado",
				"peso": 1
			},
			{
				"tipo": "script-content",
				"patron": "gtag\\('config'",
				"descripcion": "Google Analytics configuration detectado",
				"peso": 0.8
			}
		]
	}
}
