{
	"$schema": "../../schemas/pixel-v2.schema.json",
	"id": "pinterest-tag",
	"chismografo": {
		"tipo": 5,
		"version": "1.0.0",
		"ultimaActualizacion": "2026-09-11",
		"revision": 0,
		"entorno": 2
	},
	"acercaDe": {
		"detallesGenerales": {
			"nombre": "Pinterest Tag",
			"web": "https://help.pinterest.com/en/business/article/add-the-pinterest-tag-to-your-website",
			"categoria": "Redes Sociales",
			"logo": {
				"id": "pinterest.com",
				"proveedor": "logodev"
			}
		},
		"precios": []
	},
	"herramienta": {
		"reglasDeteccion": [
			{
				"tipo": "script-src",
				"patron": "s\\.pinimg\\.com\\/ct\\/core\\.js",
				"descripcion": "Pinterest Tag script detectado",
				"peso": 1
			},
			{
				"tipo": "script-content",
				"patron": "pintrk\\('load'",
				"descripcion": "Pinterest Tag initialization detectado",
				"peso": 0.8
			}
		]
	}
}
