{
	"$schema": "../../schemas/pixel-v2.schema.json",
	"id": "twitter-pixel",
	"chismografo": {
		"tipo": 5,
		"version": "1.0.0",
		"ultimaActualizacion": "2026-09-11",
		"revision": 0,
		"entorno": 2
	},
	"acercaDe": {
		"detallesGenerales": {
			"nombre": "Twitter / X Pixel",
			"web": "https://business.twitter.com/en/help/campaign-measurement-and-analytics/pixel-for-website-tracking.html",
			"categoria": "Redes Sociales",
			"logo": {
				"id": "x.com",
				"proveedor": "logodev"
			}
		},
		"precios": []
	},
	"herramienta": {
		"reglasDeteccion": [
			{
				"tipo": "script-src",
				"patron": "static\\.ads-twitter\\.com\\/uwt\\.js",
				"descripcion": "X (Twitter) Pixel script detectado",
				"peso": 1
			},
			{
				"tipo": "script-content",
				"patron": "twq\\('init'",
				"descripcion": "X (Twitter) Pixel initialization detectado",
				"peso": 0.8
			}
		]
	}
}
