{
	"$schema": "../../schemas/pixel-v2.schema.json",
	"id": "hotjar",
	"chismografo": {
		"tipo": 5,
		"version": "1.0.0",
		"ultimaActualizacion": "2026-09-11",
		"revision": 0,
		"entorno": 2
	},
	"acercaDe": {
		"detallesGenerales": {
			"nombre": "Hotjar",
			"desarrollador": "Hotjar",
			"web": "https://www.hotjar.com",
			"categoria": "Analítica",
			"logo": {
				"id": "hotjar.com",
				"proveedor": "local"
			}
		},
		"precios": []
	},
	"herramienta": {
		"reglasDeteccion": [
			{
				"tipo": "script-src",
				"patron": "hotjar\\.com|static\\.hotjar\\.com",
				"descripcion": "Hotjar integration script or resource detected"
			}
		]
	}
}
