{
	"$schema": "../../schemas/pixel-v2.schema.json",
	"id": "meta-pixel",
	"chismografo": {
		"tipo": 5,
		"version": "1.0.0",
		"ultimaActualizacion": "2026-09-11",
		"revision": 0,
		"entorno": 2
	},
	"acercaDe": {
		"detallesGenerales": {
			"nombre": "Meta Pixel",
			"web": "https://www.facebook.com/business/tools/meta-pixel",
			"categoria": "Redes Sociales",
			"logo": {
				"id": "facebook.com",
				"proveedor": "logodev"
			}
		},
		"precios": []
	},
	"herramienta": {
		"reglasDeteccion": [
			{
				"tipo": "script-src",
				"patron": "connect\\.facebook\\.net\\/en_US\\/fbevents\\.js",
				"descripcion": "Meta Pixel script detectado",
				"peso": 1
			},
			{
				"tipo": "script-content",
				"patron": "fbq\\('init'",
				"descripcion": "Meta Pixel initialization detectado",
				"peso": 0.8
			}
		]
	}
}
