{
	"$schema": "../../schemas/pixel-v2.schema.json",
	"id": "linkedin-pixel",
	"chismografo": {
		"tipo": 5,
		"version": "1.0.0",
		"ultimaActualizacion": "2026-09-11",
		"revision": 0,
		"entorno": 2
	},
	"acercaDe": {
		"detallesGenerales": {
			"nombre": "LinkedIn Insight Tag",
			"web": "https://business.linkedin.com/marketing-solutions/insight-tag",
			"categoria": "Redes Sociales",
			"logo": {
				"id": "linkedin.com",
				"proveedor": "logodev"
			}
		},
		"precios": []
	},
	"herramienta": {
		"reglasDeteccion": [
			{
				"tipo": "script-src",
				"patron": "snap\\.licdn\\.com/li\\.lms-analytics/insight\\.min\\.js|licdn\\.com.*insight",
				"descripcion": "LinkedIn Insight Tag script detectado",
				"peso": 1
			},
			{
				"tipo": "script-content",
				"patron": "_linkedin_partner_id",
				"descripcion": "LinkedIn Insight Tag configuración detectada",
				"peso": 0.8
			}
		]
	}
}
